<?xml version="1.0" encoding="UTF-8"?>
<xs:书架 xmlns="http://www.w3school.com.cn"
    xmlns:xsi="http://www.w3.org/2001/XMLSchema-instance"
    xmlns:xs="file://D:/Learn/Java/GreedySnake/src/My.xsd"
    xsi:schemaLocation="http://www.w3school.com.cn
                        My.xsd">
    <xs:书 页数="366">

        <xs:书名>jhglie</xs:书名>
        <xs:作者>2541</xs:作者>
        <xs:单价>23</xs:单价>
    </xs:书>
    <xs:书 页数="355">

        <xs:书名>jhglie</xs:书名>
        <xs:作者>2541</xs:作者>
        <xs:单价>21</xs:单价>
    </xs:书>

</xs:书架>